GTIN,Variant Name,Category Name,Brand Name,Price (€),Inventory,Image URL,Seller,MOV (€),Available Qty,Ordering Qty,Total Price (€)
6291108730515,Yara by Lattafa Perfumes Eau De Parfum 100ml 3.4 fl oz for Women,Eau De Parfum,Lattafa,13.49,1141,https://static.prod.qogita.com/files/images/variants/TWttPXFk3XuSBGeaRmb2jj.jpg,GELD3O,350.00,0,0,0.00
6085010044712,Armaf Club De Nuit Intense Man 105ml/3.6oz Eau de Toilette Cologne Spray for Men Floral 105ml,Eau De Toilette,Armaf,18.99,8573,https://static.prod.qogita.com/files/images/variants/2h9t9tGNtYLxpkmxR8bGX4.jpg,164OY1,350.00,0,0,0.00
6290360591421,Yara Moi by Lattafa 100ml Eau De Perfume Spray,Eau De Parfum,Lattafa,12.00,1625,https://static.prod.qogita.com/files/images/variants/k4ZCsCAXWYWEKeGcHKC3J2.jpg,GELD3O,350.00,0,0,0.00
6291107456041,LATTAFA FAKHAR by Lattafa Eau de Parfum Spray 3.4 oz,Eau De Parfum,Lattafa,14.92,838,https://static.prod.qogita.com/files/images/variants/7J8pi6Saxg6uHJrmQfXk3i.jpg,D3YDKE,600.00,0,0,0.00
6291108735411,Men's Asad Eau De Parfum Spray 3.4 oz Fragrances,Eau De Parfum,Lattafa,13.60,1017,https://static.prod.qogita.com/files/images/variants/JojSNinawipnDA6qqRqPu8.jpg,D3JVOD,350.00,0,0,0.00
6291107458328,Lattafa Oud For Glory Bade'e Al Oud Eau De Parfum 100ml Unisex,Eau De Parfum,Zkmagic,14.33,39,https://static.prod.qogita.com/files/images/variants/ZCzydkyUnymj9YesimstfW.jpg,6KLEXY,600.00,0,0,0.00
3346130009603,Terre D'Hermes by Hermes Eau De Toilette For Men 100ml,Eau De Toilette,Hermès,53.38,117,https://static.prod.qogita.com/files/images/variants/dfAUgB5rNfYpCnxAeLTWMJ.jpg,GELD3O,350.00,0,0,0.00
3414202000572,Davidoff Cool Water for Men Eau De Toilette 125 ml,Eau De Toilette,Davidoff,18.24,358,https://static.prod.qogita.com/files/images/variants/XfVqmsT7KJsthfr5emHvai.jpg,LEKM75,350.00,0,0,0.00
3508441001114,Aventus by Creed Eau De Parfum 100ml Musk,Eau De Parfum,Creed,202.18,19,https://static.prod.qogita.com/files/images/variants/P2ZFHzppJDdobdgCY9xFXm.jpg,2V7Q9X,350.00,0,0,0.00
6291108737194,Khamrah Eau De Parfum Unisex 100ml Vanilla Sweet Warm Spicy Woody by Lattafa Perfumes,Eau De Parfum,Lattafa,18.78,872,https://static.prod.qogita.com/files/images/variants/hwtict9pmM4WTa3aiMDGhV.jpg,EMQWQQ,400.00,0,0,0.00
6290171002338,Afnan 9 PM Eau De Parfum 100ml,Eau De Parfum,Afnan,17.48,427,https://static.prod.qogita.com/files/images/variants/VhLdYFBqgAFfk8ps9Jitu8.jpg,D3GL69,600.00,0,0,0.00
8011003993826,Versace Bright Crystal Women's Perfume EDT,Eau De Toilette,Versace,44.29,72,https://static.prod.qogita.com/files/images/variants/TkBVaD7ysCWFtboqh2ouSF.jpg,YEO149,350.00,0,0,0.00
6290360593661,Lattafa Khamrah Qahwa EDP Unisex 3.4 Fl oz,Eau De Parfum,Lattafa,18.67,2987,https://static.prod.qogita.com/files/images/variants/9pDnDpy72aNQ7UwWAzcx4j.jpg,GELD3O,350.00,0,0,0.00
6291107456058,Lattafa Fakhar Men Eau De Parfum - 100ml,Eau De Parfum,Lattafa,12.77,2008,https://static.prod.qogita.com/files/images/variants/NFLUmmCQ7LLFKadEDJhoEq.jpg,EMQWQQ,400.00,0,0,0.00
0888066000079,Tom Ford Black Orchid Eau De Perfume Spray 100ml,Eau De Parfum,Tom Ford,92.23,27,https://static.prod.qogita.com/files/images/variants/JfDhnf5iQrRERcorhrEBJK.jpg,D3GL69,600.00,0,0,0.00
6290360594552,Lattafa Yara TOUS,Eau De Parfum,Lattafa,12.10,776,https://static.prod.qogita.com/files/images/variants/P4zjkm7h3XnGof6crSS3hV.jpg,2V4GXZ,450.00,0,0,0.00
0020714999346,Aromatics Elixir by Clinique Eau de Parfum For Women 100ml,Eau De Parfum,Clinique,24.27,401,https://static.prod.qogita.com/files/images/variants/ewtaZYerwnQdZiBvwXyKbq.jpg,16QJWR,600.00,0,0,0.00
3423470890129,Narciso Rodriguez Edp vapo to spray 100ml,Eau De Parfum,Narciso Rodriguez,52.28,571,https://static.prod.qogita.com/files/images/variants/5Uv5HD7seC7w3RTgqzjvLw.jpg,VVQKD9,350.00,0,0,0.00
3349666007921,Paco Rabanne 1 Million For Men 3.4 Oz Edt Spray 100ml,Eau De Toilette,Paco Rabanne,53.55,225,https://static.prod.qogita.com/files/images/variants/4m32DiKAePkiZNyx4jpHnQ.jpg,9975VV,350.00,0,0,0.00
3605521816658,Si by Giorgio Armani Eau de Parfum For Women 100ml Chypre,Eau De Parfum,Giorgio Armani,71.84,604,https://static.prod.qogita.com/files/images/variants/aCyRJ6h3BNnjiwR4MX39nb.jpg,EMV827,400.00,0,0,0.00
0737052351100,Hugo Boss Bottled Eau de Toilette for Men 100ml,Eau De Toilette,Hugo Boss,38.63,970,https://static.prod.qogita.com/files/images/variants/MVPUcTYtSSXtHKB4zNf9k2.jpg,87WEZ3,1150.00,0,0,0.00
3423470890013,Narciso Rodriguez For Her Eau De Toilette Spray 50ml,Eau De Toilette,Narciso Rodriguez,38.46,60,https://static.prod.qogita.com/files/images/variants/PDHGkGtKET2aRTWivs5xBn.jpg,VVQKD9,350.00,0,0,0.00
6291107455365,Qaed Al Fursan Eau de Parfum for Men 90mL,Eau De Parfum,Lattafa,8.29,2673,https://static.prod.qogita.com/files/images/variants/PbCNgk2YpJkBBqjLnFoDn9.jpg,YEWKXG,600.00,0,0,0.00
3147758034905,Lancome Tresor Eau de Parfum Spray 30ml,Eau De Parfum,Lancôme,23.77,732,https://static.prod.qogita.com/files/images/variants/2KLo7gcihQDRb2vxtSJEac.jpg,GELD3O,350.00,0,0,0.00
8011003993819,Bright Crystal Eau de Toilette Vaporizer 50ml,Eau De Toilette,Versace,32.37,38,https://static.prod.qogita.com/files/images/variants/X3SC35SoNPuZVGp5rrmSpZ.jpg,VV9JDK,350.00,0,0,0.00
3423222080969,Narciso Rodriguez All Of Me EDP For Women 3.0 Fl Oz,Eau De Parfum,Narciso Rodriguez,49.40,28,https://static.prod.qogita.com/files/images/variants/BDvwfPkQAWAPdFtSwuL2uU.jpg,16E19R,350.00,0,0,0.00
6290360593142,Lattafa Badee Al Oud Sublime EDP 3.4 fl oz,Eau De Parfum,Lattafa,13.27,1204,https://static.prod.qogita.com/files/images/variants/35BwvnWM6mzymbRn97tHPS.jpg,VV9JDK,350.00,0,0,0.00
3614273636513,GIORGIO ARMANI Armani Code Eau de Toilette for Men 125ml,Eau De Toilette,Giorgio Armani,59.75,581,https://static.prod.qogita.com/files/images/variants/9kQ98k7irevkSFLr7ioADo.jpg,EMV827,400.00,0,0,0.00
8011003809202,Versace Eros for Men Eau de Toilette Spray 1.7 Ounce Fresh 0.17 Fl Oz,Eau De Toilette,Versace,30.65,52,https://static.prod.qogita.com/files/images/variants/FeYShBM3oNeL9Xbfu49rgK.jpg,GELD3O,350.00,0,0,0.00
3423470300161,Issey Miyake L'eau D'Issey Eau De Toilette Fragrance Spray 100 ml,Eau De Toilette,Issey Miyake,34.25,310,https://static.prod.qogita.com/files/images/variants/ja7TnKDdyFovWJwQ77Eb9q.jpg,EMV827,400.00,0,0,0.00
6290360598666,Lattafa Asad Zanzibar for Men 100ml Eau de Parfum Spray 3.4 Ounce,Eau De Parfum,Lattafa,11.16,2955,https://static.prod.qogita.com/files/images/variants/g6urVLW55K2fHWtF8jever.jpg,2V4GXZ,450.00,0,0,0.00
3349668515660,Invictus by Paco Rabanne Eau De Toilette for Men 100ml,Eau De Toilette,Paco Rabanne,53.98,24,https://static.prod.qogita.com/files/images/variants/5JXWpzMi2V6FG9zMD43Es4.jpg,5WZVKX,600.00,0,0,0.00
3360373016358,Cacharel Noa Eau de Toilette 100ml Women Spray,Eau De Toilette,Cacharel,24.10,325,https://static.prod.qogita.com/files/images/variants/C39GwqMWCpMnRAPHEXTY5G.jpg,EMV827,400.00,0,0,0.00
8057971183661,Dolce & Gabbana Q Eau de Parfum Spray for Women 100ml,Eau De Parfum,Dolce & Gabbana,46.19,566,https://static.prod.qogita.com/files/images/variants/MeLkTFX5z9ZAXojyT6Uu2v.jpg,YEO149,350.00,0,0,0.00
6291108733875,Unisex Bade'e Al Oud Amethyst Eau De Parfum Spray 3.38 oz Fragrances,Eau De Parfum,Lattafa,13.54,2519,https://static.prod.qogita.com/files/images/variants/LuPhWqoJmhh6tHaZWMJszQ.jpg,VV9JDK,350.00,0,0,0.00
3349668515653,Paco Rabanne Invictus Eau de Toilette 50ml,Eau De Toilette,Paco Rabanne,38.57,154,https://static.prod.qogita.com/files/images/variants/27CCTCEND2pe8DDtauRePv.jpg,GELD3O,350.00,0,0,0.00
3386460032681,Montblanc Legend Eau de Toilette 100ml,Eau De Toilette,Montblanc,26.31,128,https://static.prod.qogita.com/files/images/variants/hTrGu3fmbWy4RNyhHwwq2f.jpg,YEO149,350.00,0,0,0.00
3423470890020,Narciso Rodriguez For Her Eau de Toilette 100ml,Eau De Toilette,Narciso Rodriguez,45.87,1339,https://static.prod.qogita.com/files/images/variants/QFbedQR4K3BSe36KiRSuzc.jpg,VVQKD9,350.00,0,0,0.00
6290360599168,Lattafa Yara Candy for Women Eau de Parfum Spray 3.4 Fl Oz 100ml,Eau De Parfum,Lattafa,13.24,1414,https://static.prod.qogita.com/files/images/variants/fA54ziW6VP9ANc3w4Y4JcN.jpg,EMQWQQ,400.00,0,0,0.00
3605533286555,La Vie Est Belle by Lancome Eau De Parfum for Women 100ml Fruity,Eau De Parfum,Lancôme,67.97,743,https://static.prod.qogita.com/files/images/variants/44hWfAB3TiNciGt6ffHs95.jpg,WEDJJK,350.00,0,0,0.00
8011003809219,Eros by Versace Eau De Toilette For Men 100ml,Eau De Toilette,Versace,43.05,16,https://static.prod.qogita.com/files/images/variants/MDXPGQDR5RWTJUb94zzL59.jpg,O86XG9,350.00,0,0,0.00
3349668594412,Paco Rabanne Fame Eau De Perfume Spray 80ml,Eau De Parfum,Paco Rabanne,63.79,114,https://static.prod.qogita.com/files/images/variants/SN7AgaV7FBLPzp4FoVXsKf.jpg,EMYX81,350.00,0,0,0.00
3349668612598,Paco Rabanne Eau De Toilette for Men 50ml,Eau De Toilette,Paco Rabanne,40.84,14,https://static.prod.qogita.com/files/images/variants/KDp79Ba6L4umJo5bpywm5X.jpg,LEKM75,350.00,0,0,0.00
6291108739020,Qaed Al Fursan Unlimited 90ml Eau de Parfum by Lattafa White Edition Oriental Perfume for Men and Women,Eau De Parfum,Lattafa,7.74,1002,https://static.prod.qogita.com/files/images/variants/BFtkmjnD7Yeq6vK2VeqJLH.jpg,YEO149,350.00,0,0,0.00
8011003861224,Versace Eros  Eau de Parfum Vapo 100ml,Eau De Parfum,Versace,49.18,143,https://static.prod.qogita.com/files/images/variants/oHkFXLQYm3iTe2tGL3f7BK.jpg,LEG4LL,650.00,0,0,0.00
3346130013457,Hermes Terre D'Hermes Eau de Toilette Spray 200ml,Eau De Toilette,Hermès,80.79,195,https://static.prod.qogita.com/files/images/variants/986wejrTJGbL782ZwvbGnU.jpg,335631,600.00,0,0,0.00
3147758029383,Miracle Eau De Parfum 100ml Spray,Eau De Parfum,Lancôme,61.89,84,https://static.prod.qogita.com/files/images/variants/HevEFPmTTJuapeZkzUf93R.jpg,VV9JDK,350.00,0,0,0.00
3423222080952,Narciso Rodriguez All Of Me Eau de Parfum 50ml,Eau De Parfum,Narciso Rodriguez,39.60,1,https://static.prod.qogita.com/files/images/variants/5nHfZcmxZF4TNHmU98Xknr.jpg,VV9JDK,350.00,0,0,0.00
3360373063697,Cacharel Eau de Toilette for Women 30ml,Eau De Toilette,Cacharel,11.93,119,https://static.prod.qogita.com/files/images/variants/3iis5LWveWCqWF56Care2N.jpg,9975VV,350.00,0,0,0.00
0088300162505,Calvin Klein Euphoria Eau de Parfum 100ml,Eau De Parfum,Calvin Klein,30.01,1274,https://static.prod.qogita.com/files/images/variants/ihvkoWnRYjZgTPMS3LpZSH.jpg,VV9JDK,350.00,0,0,0.00
3423473053958,Narciso Rodriguez Narciso Ambree Eau De Parfum Spray 90ml/3oz,Eau De Parfum,Narciso Rodriguez,52.65,31,https://static.prod.qogita.com/files/images/variants/UCMtkj2Fru34qu5BcdbWbw.jpg,VV9JDK,350.00,0,0,0.00
6291106066890,Lattafa Perfumes Ana Abiyedh Eau de Parfum Spray Vanilla Saffron 60ml,Eau De Parfum,Lattafa,8.17,1796,https://static.prod.qogita.com/files/images/variants/ihK9MGxNR8UZv5sXvZrsgi.jpg,D3JVOD,350.00,0,0,0.00
3414202011752,Davidoff Cool Water Eau De Toilette Spray 100ml,Eau De Toilette,Davidoff,15.43,423,https://static.prod.qogita.com/files/images/variants/MWjmsJWCV2o5MMcXQWfWdg.jpg,VV9JDK,350.00,0,0,0.00
3423470311365,L'Eau d'Issey For Men Eau De Toilette 125ml,Eau De Toilette,Issey Miyake,29.83,495,https://static.prod.qogita.com/files/images/variants/2YjSWKZGs8Dtpaff7KmpdR.jpg,EMV827,400.00,0,0,0.00
8011003995967,Versace Pour Homme Eau De Toilette Spray 100ml,Eau De Toilette,Versace,36.97,131,https://static.prod.qogita.com/files/images/variants/e6siAAdfSTqdtBxru5fuEV.jpg,O86ZD9,350.00,0,0,0.00
3423474896257,Zadig and Voltaire This is Him Eau de Toilette Spray 100ml,Eau De Toilette,Zadig & Voltaire,39.51,107,https://static.prod.qogita.com/files/images/variants/9Uqn7rmtoCj2VtAkcsnpfr.jpg,5WZVKX,600.00,0,0,0.00
3423470311358,Issey Miyake Eau D Issey Homme EDT Vapo 75ml,Eau De Toilette,Issey Miyake,21.82,248,https://static.prod.qogita.com/files/images/variants/Cywc3TmkEvybncg6LHgoGF.jpg,EMV827,400.00,0,0,0.00
3414206000608,Joop! Homme Eau de Toilette 125ml Spray For Him,Eau De Toilette,Joop!,17.41,59,https://static.prod.qogita.com/files/images/variants/SuPBuLre6zq2CwsWXPVvMK.jpg,LEKM75,350.00,0,0,0.00
8018365260757,Versace Blue Jeans Eau De Toilette for Men 75ml,Eau De Toilette,Versace,12.66,424,https://static.prod.qogita.com/files/images/variants/T8PcQdSJMe9AkYw2CvgXSf.jpg,O86XG9,350.00,0,0,0.00
0737052351018,Hugo Boss Bottled Eau de Toilette Spray 50ml,Eau De Toilette,Hugo Boss,24.15,18,https://static.prod.qogita.com/files/images/variants/TcdZAR9sT2Ucm4Yra3ddiG.jpg,GE345G,600.00,0,0,0.00
3439600056969,Thierry Mugler Alien Eau de Parfum Spray 90ml,Eau De Parfum,Thierry Mugler,65.21,68,https://static.prod.qogita.com/files/images/variants/bVtZSMqVTtWhBcsLEs5SuX.jpg,O86ZD9,350.00,0,0,0.00
8018365270756,Versace Red Jeans Eau De Toilette For Woman 75ml,Eau De Toilette,Versace,11.50,3490,https://static.prod.qogita.com/files/images/variants/SrLdrPwMokF3F7o6JiGCoS.jpg,335631,600.00,0,0,0.00
6290360593166,Lattafa Fakhar Gold EDP Extrait 3.4 Fl Oz,Extrait De Parfum,Lattafa,13.05,3668,https://static.prod.qogita.com/files/images/variants/T3mN6T6ZAraSzRNTnmLohj.jpg,YEWKXG,600.00,0,0,0.00
3365440003866,Yves Saint Laurent Kouros Eau De Toilette Spray 100ml,Eau De Toilette,Yves Saint Laurent,40.39,278,https://static.prod.qogita.com/files/images/variants/UGM4eLxeWs4oetC8Yg34TU.jpg,D3GL69,600.00,0,0,0.00
3423470300154,Issey Miyake L'eau D'issey Eau De Toilette Spray for Women 1.6 Ounce Floral 1.60 Fl Oz,Eau De Toilette,Issey Miyake,23.77,51,https://static.prod.qogita.com/files/images/variants/mEaHohDGWW4Lx3ga9eNUat.jpg,GELD3O,350.00,0,0,0.00
3346130009610,Hermès Terre D'hermès Eau De Toilette 50ml,Eau De Toilette,Hermès,38.68,271,https://static.prod.qogita.com/files/images/variants/ifg6rfuxx3ad5G5Rvw5yyk.jpg,16E19R,350.00,0,0,0.00
0085805268848,Elizabeth Arden Green Tea Scent Spray 100ml,Eau De Toilette,Elizabeth Arden,9.29,652,https://static.prod.qogita.com/files/images/variants/De9cSTW8dEmXXqpWGyZpHZ.jpg,16QJWR,600.00,0,0,0.00
3386460101035,Montblanc Explorer 100ml Eau de Parfum Spray For Men,Eau De Parfum,Montblanc,36.45,73,https://static.prod.qogita.com/files/images/variants/294eZ45BMrvN9fFjLRtFAk.jpg,YEO149,350.00,0,0,0.00
8011003861903,Versace Eros Versace Eros Eau de Parfum Spray 50ml Patchouli and Sage,Eau De Parfum,Versace,35.37,30,https://static.prod.qogita.com/files/images/variants/jb3NizQ9w52mZpvpB7LCGU.jpg,9975VV,350.00,0,0,0.00
0088300104437,Calvin Klein CK Be Eau de Toilette 200ml Vaporizer Unisex Adults' Black Musk,Eau De Toilette,Calvin Klein,17.13,729,https://static.prod.qogita.com/files/images/variants/fneWs4MPtGfck6v7nfZ99g.jpg,JEL9LW,350.00,0,0,0.00
0020714001940,Clinique Aromatics Elixir Eau De Parfum 45ml,Eau De Parfum,Clinique,16.64,43,https://static.prod.qogita.com/files/images/variants/DyYku5FydF5PWhxdan8isb.jpg,LEKM75,350.00,0,0,0.00
0088300107438,Calvin Klein CK One Eau De Toilette Unisex Spray 200ml,Eau De Toilette,Calvin Klein,23.16,237,https://static.prod.qogita.com/files/images/variants/NMgdeefZuVvzoGm4svCuSM.jpg,LEKM75,350.00,0,0,0.00
3349668582297,Paco Rabanne Phantom Eau De Toilette Spray 100ml,Eau De Toilette,Paco Rabanne,54.05,96,https://static.prod.qogita.com/files/images/variants/PT2EQ2VXe2pVjHtbxPbwpC.jpg,VV9JDK,350.00,0,0,0.00
3365440316560,YSL L'Homme for Men Eau De Toilette 100ml,Eau De Toilette,Yves Saint Laurent,56.18,11,https://static.prod.qogita.com/files/images/variants/JnrdmVeLU9HD8AZXz5NWAa.jpg,GELD3O,350.00,0,0,0.00
3349668021345,Paco Rabanne Pour Homme Eau De Toilette for Men 100ml,Eau De Toilette,Paco Rabanne,22.00,295,https://static.prod.qogita.com/files/images/variants/M4r3uGaG5K2MDYhbwtKHbQ.jpg,7XE172,1150.00,0,0,0.00
3439600056525,Thierry Mugler Angel Eau de Parfum Refillable 25ml,Eau De Parfum,Thierry Mugler,35.09,27,https://static.prod.qogita.com/files/images/variants/fGWRTVRcfUDC6jRdbGpFSg.jpg,GELD3O,350.00,0,0,0.00
3365440787971,Black Opium by Yves Saint Laurent Eau De Parfum for Women 90ml,Eau De Parfum,Yves Saint Laurent,75.61,27,https://static.prod.qogita.com/files/images/variants/HfAE38HaiikSE9kaWSz4kF.jpg,D3VZ59,600.00,0,0,0.00
0085805390600,Elizabeth Arden 5th Avenue Eau de Parfum for Women 125ml,Eau De Parfum,Elizabeth Arden,15.20,2329,https://static.prod.qogita.com/files/images/variants/gBaVqXfLCx5mxtAKQrxdgS.jpg,873173,350.00,0,0,0.00
3386460121514,Montblanc Explorer Ultra Blue Eau de Parfum 100ml,Eau De Parfum,Montblanc,27.63,24,https://static.prod.qogita.com/files/images/variants/9K3JQqnBGgegQQNZZx3WKP.jpg,7X38GR,350.00,0,0,0.00
3386460135825,Montblanc Explorer Platinum Eau de Parfum 60ml,Eau De Parfum,Montblanc,23.21,99,https://static.prod.qogita.com/files/images/variants/bqcYbB3W2WFhtSMCgfMweF.jpg,YEO149,350.00,0,0,0.00
3439601204611,Thierry Mugler Alien Goddess Eau de Parfum for Women 60ml,Eau De Parfum,Thierry Mugler,38.24,166,https://static.prod.qogita.com/files/images/variants/Xn5BjCMAcCwsZP4TGmJHdg.jpg,335631,600.00,0,0,0.00
3349668594429,Paco Rabanne Fame Eau de Parfum 50ml,Eau De Parfum,Paco Rabanne,48.79,15,https://static.prod.qogita.com/files/images/variants/E6oqNgSsRGU7y6qG49PibZ.jpg,EMYX81,350.00,0,0,0.00
3423478925557,Narciso Rodriguez Woman Eau de Toilette Spray 30ml,Eau De Toilette,Narciso Rodriguez,25.98,196,https://static.prod.qogita.com/files/images/variants/LB2Uuay7ZwwfLaGNBdJQU4.jpg,16E19R,350.00,0,0,0.00
8011003825745,Gianni Versace Pour Homme Dylan Blue Eau De Toilette Spray for Men 100ml,Eau De Toilette,Versace,41.94,55,https://static.prod.qogita.com/files/images/variants/a9Yj7XrucjeXyydV8RwgrM.jpg,9975VV,350.00,0,0,0.00
3423478806054,Narciso Rodriguez for Him Bleu Noir EDT 100ml,Eau De Toilette,Narciso Rodriguez,35.65,27,https://static.prod.qogita.com/files/images/variants/eCey2RJJHBHtnuDzEnPvoZ.jpg,GELD3O,350.00,0,0,0.00
3423470890136,For Her by Narciso Rodriguez Eau de Parfum for Women 50ml,Eau De Parfum,Narciso Rodriguez,42.03,60,https://static.prod.qogita.com/files/images/variants/HRjZUSEf6ALsDDYHtuZys6.jpg,16E19R,350.00,0,0,0.00
0888066015509,Tom Ford Noir Eau De Perfume Spray 100ml,Eau De Parfum,Tom Ford,91.73,72,https://static.prod.qogita.com/files/images/variants/9BadQ3krnqTcj9VTAXL4na.jpg,VV9JDK,350.00,0,0,0.00
8011003876280,Versace Dylan Purple Eau de Parfum Spray 100ml,Eau De Parfum,Versace,47.47,240,https://static.prod.qogita.com/files/images/variants/gmRJY3nqihhyC5kgwsdbAf.jpg,87WEZ3,1150.00,0,0,0.00
3423222107611,Narciso Rodriguez for her MUSC NUDE EAU DE PARFUM 50ml,Eau De Parfum,Narciso Rodriguez,44.35,500,https://static.prod.qogita.com/files/images/variants/XvDgftFLBWFytQCUJd6YYC.jpg,MOWM93,900.00,0,0,0.00
3423474891856,Zadig and Voltaire Ladies This is Her! Eau De Parfum Spray 3.4 oz (100 ml),Eau De Parfum,Zadig & Voltaire,46.70,1000,https://static.prod.qogita.com/files/images/variants/5SnUF2adnphkAW4JAuEgKB.jpg,6KQD6V,350.00,0,0,0.00
3360373063680,Cacharel Amor Amor Eau de Toilette 100ml,Eau De Toilette,Cacharel,24.32,27,https://static.prod.qogita.com/files/images/variants/2iLqoTNZwg3SSVhLcZtX8n.jpg,7X38GR,350.00,0,0,0.00
3423470485448,Issey Miyake L'Eau d'Issey Pour Homme Eau de Toilette Spray 200ml,Eau De Toilette,Issey Miyake,43.10,488,https://static.prod.qogita.com/files/images/variants/it9TqMN9YDj6xKpSviodUe.jpg,EMV827,400.00,0,0,0.00
0088300104680,Calvin Klein CK Be 50ml Eau de Toilette Spray for Men or Women - New,Eau De Toilette,Calvin Klein,9.94,469,https://static.prod.qogita.com/files/images/variants/HfhVX3k9XPFrhHpWzjmYda.jpg,2V8QWL,350.00,0,0,0.00
0850018802598,Olaplex N° 4 Bond Maintenance Shampoo 250ml,Shampoo,Olaplex,13.50,152,https://static.prod.qogita.com/files/images/variants/FwRNSs5o7Rc7NGCinUZjxa.jpg,EM8RJL,350.00,0,0,0.00
8005610481081,Bloom by Gucci Eau de Parfum For Women 30ml,Eau De Parfum,Gucci,31.94,300,https://static.prod.qogita.com/files/images/variants/GB9JdjnVKfR6vwTFvBnVQK.jpg,7XE172,1150.00,0,0,0.00
3346133500046,Hermès H24 Homme Eau de Toilette 50ml,Eau De Toilette,Hermès,34.66,19,https://static.prod.qogita.com/files/images/variants/8ehKJg9MsaYrEtrHRxLb4h.jpg,VVL4XX,350.00,0,0,0.00
3614272907690,Giorgio Armani My Way Eau De Parfum for Women 90ml,Eau De Parfum,Giorgio Armani,71.34,350,https://static.prod.qogita.com/files/images/variants/WEXEmjk6KNsE2mqDyNfKNB.jpg,87WEZ3,1150.00,0,0,0.00
3346138900087,A Garden On The Nile Hermes Eau de Toilette Spray 100ml,Eau De Toilette,Hermès,60.73,107,https://static.prod.qogita.com/files/images/variants/jm9WasvJUqxeYRFG2MEnHm.jpg,VVQKD9,350.00,0,0,0.00
3349668612611,Paco Rabanne Lady Million Eau de Parfum Spray for Women Black 30ml,Eau De Parfum,Paco Rabanne,34.48,20,https://static.prod.qogita.com/files/images/variants/jcKR6c3AHfPGvooshy5s5j.jpg,GELD3O,350.00,0,0,0.00
8435415076838,Jean Paul Gaultier Divine Eau De Perfume Spray Rechargeable 100ml,Eau De Parfum,Jean Paul Gaultier,73.33,10,https://static.prod.qogita.com/files/images/variants/mRp4NWMZdHHdzNSK4XrA4V.jpg,7X5Z9J,600.00,0,0,0.00
0020714005887,Clinique Aromatics Elixir 25ml Eau Du Parfum Spray,Eau De Parfum,Aromatics Elixir,11.61,169,https://static.prod.qogita.com/files/images/variants/7aUdXHPj8H7gjNBTxAGQyV.jpg,16QJWR,600.00,0,0,0.00
6291107454412,Ana Abiyedh Rouge Unisex Eau De Parfum 60ml by Lattafa,Eau De Parfum,Lattafa,8.28,82,https://static.prod.qogita.com/files/images/variants/YVTVNCVYg5fbx6NNgSfoFH.jpg,EMJO9Q,350.00,0,0,0.00
0088300104406,Calvin Klein C K Be Unisex Eau De Toilette Spray 100ml,Eau De Toilette,Calvin Klein,13.38,240,https://static.prod.qogita.com/files/images/variants/BQMoygS4S4Ui52sD2e4cjJ.jpg,LEKM75,350.00,0,0,0.00
3607346232347,Chloe for Women Eau de Parfum 50ml,Eau De Parfum,Chloé,44.76,31,https://static.prod.qogita.com/files/images/variants/bkT9rQYA2JQaoDVbrFRz9M.jpg,2V8QWL,350.00,0,0,0.00
3349668566372,1 Million by Paco Rabanne Eau De Toilette For Men 200ml Fresh,Eau De Toilette,Paco Rabanne,74.16,98,https://static.prod.qogita.com/files/images/variants/R2L64kyNTVAeL9KMQa8gxy.jpg,VV9JDK,350.00,0,0,0.00
3349668568093,Olympea by Paco Rabanne Eau De Parfum for Women 50ml,Eau De Parfum,Paco Rabanne,48.48,24,https://static.prod.qogita.com/files/images/variants/PiZ5ZppFzY4wwTeFnvBBTN.jpg,XDR492,350.00,0,0,0.00
3346138900094,Hermes Un Jardin Sur Le Nil Eau De Toilette Spray 1.7-Ounces for Men,Eau De Toilette,Hermès,37.58,84,https://static.prod.qogita.com/files/images/variants/Fv8ns8B3vmxj9yi87fXNHc.jpg,335631,600.00,0,0,0.00
3349668594603,Paco Rabanne Fame Eau de Parfum 30ml,Eau De Parfum,Paco Rabanne,33.90,95,https://static.prod.qogita.com/files/images/variants/PyU7d9sQK2VqJ7aQG43ruY.jpg,WEDW13,350.00,0,0,0.00
0027131043294,Estee Lauder Pleasures Women 50ml Eau De Parfum,Eau De Parfum,Estée Lauder,19.78,500,https://static.prod.qogita.com/files/images/variants/nEysjpJdLCxjA95dy2apa4.jpg,MOWM93,900.00,0,0,0.00
8011003839117,Gianni Versace Dylan Blue Pour Femme Eau de Parfum 100ml,Eau De Parfum,Versace,48.58,120,https://static.prod.qogita.com/files/images/variants/4VKFAWWMhwbkZxTsTKpwHt.jpg,87WEZ3,1150.00,0,0,0.00
3386460127950,Montblanc Legend Red Eau de Parfum 100ml,Eau De Parfum,Montblanc,26.35,162,https://static.prod.qogita.com/files/images/variants/jHN6wiady9xCr86YxgTLXo.jpg,D3GL69,600.00,0,0,0.00
8005610481005,Bloom by Gucci Eau de Parfum For Women 100ml,Eau De Parfum,Gucci,59.36,70,https://static.prod.qogita.com/files/images/variants/EbZ9mpsJ7fcbq9YWpd9PLj.jpg,VVL4XX,350.00,0,0,0.00
8057971183722,Dolce and Gabbana Devotion Eau de Parfum 50ml,Eau De Parfum,Dolce & Gabbana,44.04,265,https://static.prod.qogita.com/files/images/variants/TsaYf3vD4mgJyc6TUAe9Cf.jpg,YEO149,350.00,0,0,0.00
8011003876273,VERSACE Dylan Purple EDP 50ml,Eau De Parfum,Versace,38.24,60,https://static.prod.qogita.com/files/images/variants/9qP3Vosoi3csSZXtoXmcZP.jpg,O86ZD9,350.00,0,0,0.00
0027131086871,Estee Lauder Beautiful Eau de Parfum Spray 75ml for Women,Eau De Parfum,Estée Lauder,30.61,30,https://static.prod.qogita.com/files/images/variants/QFrrTH32WPExhA6rbUZ9tR.jpg,XDR492,350.00,0,0,0.00
3346470131385,Mon by Guerlain Eau de Parfum For Women 30ml,Eau De Parfum,Guerlain,31.83,32,https://static.prod.qogita.com/files/images/variants/Hzs5K5LKnUnvuhT6tugVP2.jpg,VVL4XX,350.00,0,0,0.00
8435415076821,Jean Paul Gaultier Divine Eau de Parfum Refillable 50ml,Eau De Parfum,Jean Paul Gaultier,53.99,12,https://static.prod.qogita.com/files/images/variants/3GUwQLknbX4crgosjmonut.jpg,7X5Z9J,600.00,0,0,0.00
3439600056914,Thierry Mugler Alien / EDP Refillable Talismans Spray 1.0 oz (30 ml),Eau De Parfum,Thierry Mugler,37.54,66,https://static.prod.qogita.com/files/images/variants/nXe9eH5C9NQ3Ca9CN9dfiE.jpg,XDR492,350.00,0,0,0.00
0888066000062,Tom Ford Black Orchid Eau De Parfum Spray 50ml,Eau De Parfum,Tom Ford,71.45,157,https://static.prod.qogita.com/files/images/variants/kpo9JzXaRQPbKo6GkbAmQi.jpg,7XE172,1150.00,0,0,0.00
0027131006534,Estee Lauder Knowing Women's Eau De Parfum Perfume 75ml,Eau De Parfum,Estée Lauder,29.79,43,https://static.prod.qogita.com/files/images/variants/JQPTaipmgyUUmkrLiviFsr.jpg,873173,350.00,0,0,0.00
3349668582365,Paco Rabanne Phantom Oriental Eau de toilette Spray 50ml,Eau De Toilette,Paco Rabanne,39.79,276,https://static.prod.qogita.com/files/images/variants/jDW7SKAXnpFPWvTinnGC8i.jpg,EMYX81,350.00,0,0,0.00
3346132400019,Hermes Un Jardin Sur Le Toit Eau De Toilette Spray 100ml 3.3 Fl Oz,Eau De Toilette,Hermès,53.94,115,https://static.prod.qogita.com/files/images/variants/YtQGMKGQcUQjxgDnoPV9QY.jpg,335631,600.00,0,0,0.00
3614229828535,BOSS Bottled Eau De Parfum 100ml,Eau De Parfum,Hugo Boss,42.66,6,https://static.prod.qogita.com/files/images/variants/DLRwV7LeRnD9h57G82qV7Y.jpg,GELD3O,350.00,0,0,0.00
8011003823536,Versace Eros Pour Femme Eau De Parfum for Women 100ml,Eau De Parfum,Versace,50.79,271,https://static.prod.qogita.com/files/images/variants/9GBhNPurYTHFoWLmpYgWKy.jpg,87WEZ3,1150.00,0,0,0.00
3605532612690,Lancôme La Vie est Belle Eau de Parfum Spray 30ml,Eau De Parfum,Lancôme,35.37,378,https://static.prod.qogita.com/files/images/variants/kNi7VDMdDwuYfWbq4Wkn9j.jpg,16E19R,350.00,0,0,0.00
