GTIN,Variant Name,Category Name,Brand Name,Price (€),Inventory,Image URL,Seller,MOV (€),Available Qty,Ordering Qty,Total Price (€)
0192333066942,Clinique Moisture Surge 100H Auto-Replenishing Hydrator 75ml,Face Cream,Clinique,21.00,1000,https://static.prod.qogita.com/files/images/variants/fCZ2vDmnh2aTDV349kXNbu.jpg,16QJWR,600.00,0,0,0.00
3348901181839,Christian Dior Dior Addict Eau de Parfum Spray 100ml,Eau De Parfum,Dior,98.36,29,https://static.prod.qogita.com/files/images/variants/TheSvRUV7QsdrPwM3xgduQ.jpg,6KQD6V,350.00,0,0,0.00
8011003996179,Versace The Dreamer Eau de Toilette for Him 50ml,Eau De Toilette,Versace,16.80,206,https://static.prod.qogita.com/files/images/variants/FnRbv9ewqJQrJcnSccUtPo.jpg,9975VV,350.00,0,0,0.00
8011530820022,Trussardi Donna Women Eau de Parfum Spray 3.4 Ounce,Eau De Parfum,Trussardi,30.33,90,https://static.prod.qogita.com/files/images/variants/LZSrxAgN7U7n8gP8oWVcPq.jpg,VVLDG9,350.00,0,0,0.00
3614273852821,Yves Saint Laurent MYSLF Eau de Parfum 60ml,Eau De Parfum,Yves Saint Laurent,50.29,94,https://static.prod.qogita.com/files/images/variants/RH7CtCqkRADHFgXNkssdem.jpg,16E19R,350.00,0,0,0.00
3386460077019,Eau De Rochas Shower Gel 500ml,Shower Gel,Rochas,12.71,180,https://static.prod.qogita.com/files/images/variants/NVdgZs3n6xJMtWXxBojr4n.jpg,LEKM75,350.00,0,0,0.00
3337875684101,Cerave SA Smoothing Cream Anti-Roughness 340g,Body Lotion,CeraVe,12.12,480,https://static.prod.qogita.com/files/images/variants/WEF9JYQ5YN3GJCMsWuaUWY.jpg,YE2ZM5,350.00,0,0,0.00
8015150250573,Collistar Intensive Firming Cream 400ml,Face Cream,Collistar,20.51,29,https://static.prod.qogita.com/files/images/variants/JLvPKNCA3mXuaSVtkFc4NG.jpg,5W7KXX,350.00,0,0,0.00
3386460066181,Montblanc Lady Emblem Eau de Parfum 75ml,Eau De Parfum,Montblanc,21.68,58,https://static.prod.qogita.com/files/images/variants/eePaeUzgG9Q5PsZJ4rEcRh.jpg,D3YYY9,350.00,0,0,0.00
3360372009641,Guy Laroche Fidji Women Eau de Toilette Spray Perfume 100ml,Eau De Toilette,Guy Laroche,20.89,1000,https://static.prod.qogita.com/files/images/variants/NHuS88RQb7aoxvoRQDJRuu.jpg,33E563,1350.00,0,0,0.00
3614226905284,Burberry Weekend Women's Perfume 100ml Sage Mandarin Reseda,Eau De Parfum,Burberry,26.41,97,https://static.prod.qogita.com/files/images/variants/m6988KHaA3nb7hDDcQv5vk.jpg,YEO149,350.00,0,0,0.00
3386460078597,Rochas Tocade Eau de Toilette Spray 3.3 Fl Oz 100ml,Eau De Toilette,Rochas,23.77,500,https://static.prod.qogita.com/files/images/variants/AwdtvsotoxNtxypGCizJKY.jpg,MOWM93,900.00,0,0,0.00
3348900011687,"Christian Dior Poison Eau de Toilette Spray for Women, 100ml",Eau De Toilette,Dior,83.71,18,https://static.prod.qogita.com/files/images/variants/PFSMAPP6VKHBCVWsGqjpcN.jpg,EMYX81,350.00,0,0,0.00
8435415076814,Jean Paul Gaultier Divine Eau de Parfum 30ml Refillable,Eau De Parfum,Jean Paul Gaultier,40.36,18,https://static.prod.qogita.com/files/images/variants/B6Ub8BXCbvyRZpzyGuXux3.jpg,7X5Z9J,600.00,0,0,0.00
3607342635876,Chloe Love Story Eau De Parfum Spray 75ml,Eau De Parfum,Chloé,58.80,158,https://static.prod.qogita.com/files/images/variants/XFT8iT6DKt3dqduYizzorh.jpg,8738KJ,350.00,0,0,0.00
3349668555062,Black XS Women's Eau de Parfum Spray 80ml,Eau De Parfum,Paco Rabanne,49.12,28,https://static.prod.qogita.com/files/images/variants/AhFDHWb7vWFFV8pYegpmzq.jpg,YEO149,350.00,0,0,0.00
3614274076578,Yves Saint Laurent Black Opium Over Red Eau de Parfum 50ml,Eau De Parfum,Yves Saint Laurent,65.76,10,https://static.prod.qogita.com/files/images/variants/7GS4LdPAwvF83jqNLvPZPW.jpg,875W4X,350.00,0,0,0.00
3614273776134,Yves Saint Laurent Libre Le Parfum Eau de Parfum 30ml,Eau De Parfum,Yves Saint Laurent,52.38,60,https://static.prod.qogita.com/files/images/variants/TXgYACHz9kD32HWTK7csgk.jpg,875W4X,350.00,0,0,0.00
3614273335812,Emporio Armani Stronger with You Absolutely Perfume 50ml Men's Fragrance,Eau De Parfum,Giorgio Armani,47.69,175,https://static.prod.qogita.com/files/images/variants/V9YLFKGpVHstiAUMzinUtP.jpg,VVL4XX,350.00,0,0,0.00
3337875597203,CeraVe Micellar Cleansing Water for All Skin Types 295ml with Niacinamide and Ceramides,Micellar Water,CeraVe,7.46,120,https://static.prod.qogita.com/files/images/variants/KwuogsoaWEz67MuXxyzX9T.jpg,YE2ZM5,350.00,0,0,0.00
3348901250269,DIOR Sauvage After-shave Lotion Bottle 100ml,Aftershave,Dior,42.99,76,https://static.prod.qogita.com/files/images/variants/CKkck9VhJ9KMa9RNHdfBrr.jpg,EMYX81,350.00,0,0,0.00
3386460066075,Boucheron Quatre Eau de Parfum Spray for Women 100ml,Eau De Parfum,Boucheron,27.52,1174,https://static.prod.qogita.com/files/images/variants/enapr2zhVDWDvfqgDWXbPD.jpg,335631,600.00,0,0,0.00
8435415012720,Jean Paul Gaultier Men's After Shave 4.2 oz - 100% Authentic,Aftershave,Jean Paul Gaultier,40.87,16,https://static.prod.qogita.com/files/images/variants/S7KsCspHJefJkP7pXjeL3t.jpg,16Y9RM,350.00,0,0,0.00
3614273764209,Thierry Mugler Angel Eau de Parfum for Women 100 ml refill,Eau De Parfum,Thierry Mugler,65.21,409,https://static.prod.qogita.com/files/images/variants/Fkf5yV5XdEtTsABwfXzwxf.jpg,WEDJJK,350.00,0,0,0.00
3360377009356,Ralph Lauren Ralph Woman EDT 50ml,Eau De Toilette,Ralph Lauren,17.96,119,https://static.prod.qogita.com/files/images/variants/h7B4uW4mftqRWZxper4R7R.jpg,16XOM1,500.00,0,0,0.00
0088300601387,Calvin Klein Eternity For Women Eau de Parfum 30ml,Eau De Parfum,Calvin Klein,17.41,63,https://static.prod.qogita.com/files/images/variants/hBuW4VHtkbyx8j6kJJdiPA.jpg,6KLEXY,600.00,0,0,0.00
3348900606708,Dior Pure Poison Eau de Parfum 50ml,Eau De Parfum,Dior,70.73,8,https://static.prod.qogita.com/files/images/variants/VJhFipaXaRx5sK8gdG4EZ2.jpg,GELD3O,350.00,0,0,0.00
3274870002687,Givenchy Ange Ou Demon Le Secret By Eau De Parfum Spray For Women 1.0 Oz (W) 30ml,Eau De Parfum,Givenchy,28.27,12,https://static.prod.qogita.com/files/images/variants/3RtJE38aCGt8yLpm7JUpLA.jpg,VVLDG9,350.00,0,0,0.00
6295124024832,Shaghaf Oud Eau de Parfum 75mL Mouthwatering Gourmand Oud and Saffron Fragrance Long Lasting with Intense Sillage Cologne for Men and Perfume for Women by Oudh Artisan Swiss Arabian,Eau De Parfum,Swiss Arabian,14.52,306,https://static.prod.qogita.com/files/images/variants/6UMHNXkB9vzMBhUh4HirHx.jpg,EMJO9Q,350.00,0,0,0.00
3474636974214,L'Oréal  Absolut Repair Shampoo 300ml,Shampoo,L'Oréal Professionnel,8.36,24,https://static.prod.qogita.com/files/images/variants/jU32rsWbxZChyUHnc8Hvfn.jpg,5WODEX,350.00,0,0,0.00
3666057019050,Clarins Men's Super Moisture Gel 50ml,Face Cream,Clarins,18.69,389,https://static.prod.qogita.com/files/images/variants/7b8yxvstGzaw2uR7SF95hh.jpg,VVLDG9,350.00,0,0,0.00
3349668530564,Paco Rabanne Deodorant Spray 150ml,Deodorant & Anti-Perspirant,Paco Rabanne,18.07,84,https://static.prod.qogita.com/files/images/variants/HtRMnHY3DTmXFQwpeeTYzJ.jpg,87KEE9,600.00,0,0,0.00
3666057037429,Clarins Lip Comfort Oil 01 Honey 7ml,Lip Gloss,Clarins,11.65,33,https://static.prod.qogita.com/files/images/variants/FQGhCnqpAC63U5RQKfkTXY.jpg,D3VZ59,600.00,0,0,0.00
3614270561665,Mon Paris by Yves Saint Laurent Eau De Parfum for Women 30ml,Eau De Parfum,Yves Saint Laurent,36.47,126,https://static.prod.qogita.com/files/images/variants/PkujsnXpyQTHcHTf8bcZ7b.jpg,16E19R,350.00,0,0,0.00
8411061711767,Carolina Herrera 212 VIP Women's Eau de Parfum Spray 2.7oz,Eau De Parfum,Carolina Herrera,53.36,162,https://static.prod.qogita.com/files/images/variants/HXsUXf49RKCpuWTfgYyK8a.jpg,VV9JDK,350.00,0,0,0.00
8411061991909,Carolina Herrera Bad Boy Le Parfum Eau De Parfum 50ml,Eau De Parfum,Carolina Herrera,46.38,116,https://static.prod.qogita.com/files/images/variants/NLYzLqRGoBEgDPgjjaXxPw.jpg,VV9JDK,350.00,0,0,0.00
3349668630028,Paco Rabanne Phantom Eau de Parfum Spray,Eau De Parfum,Paco Rabanne,47.25,25,https://static.prod.qogita.com/files/images/variants/8RKaSG2zk8aSxWKzZbBfhC.jpg,873K33,600.00,0,0,0.00
8057971188291,Dolce & Gabbana Dolce G Devotion Eau De Parfum Intense 100ml,Eau De Parfum,Dolce & Gabbana,61.41,40,https://static.prod.qogita.com/files/images/variants/DQdTgSrv2d9w8CDznrSbwa.jpg,XDR492,350.00,0,0,0.00
3474636692408,Kérastase Blond Absolu Anti-Brass Purple Hair Mask with Hyaluronic Acid and Edelweiss Flower 200ml,Hair Masks,Kérastase,22.11,8,https://static.prod.qogita.com/files/images/variants/VqifMDLiaeAXR4EhGzbzpZ.jpg,QV4JYK,350.00,0,0,0.00
3666057042317,Clarins Men Active Face Wash Foaming Gel 125ml,Cleansing Gel,Clarins,13.01,197,https://static.prod.qogita.com/files/images/variants/7yL7x34JDMuTctGa7JvFS9.jpg,D3VZ59,600.00,0,0,0.00
3337875840620,CeraVe Moisturizing Face Day Cream SPF 30 52ml,Day Cream,CeraVe,9.80,2964,https://static.prod.qogita.com/files/images/variants/JZ9cEbWMTysXrUSHRJ4HUL.jpg,YE2ZM5,350.00,0,0,0.00
3614270952654,Giorgio Armani 3614270952654 Eau de Parfum Spray Perfume 150g,Eau De Parfum,Giorgio Armani,88.36,118,https://static.prod.qogita.com/files/images/variants/QnDhAMPYrEkzSLMKkWDS67.jpg,VVQKD9,350.00,0,0,0.00
0085805557355,Elizabeth Arden White Tea Body Cream 400ml,Body Lotion,Elizabeth Arden,11.31,97,https://static.prod.qogita.com/files/images/variants/8HSVY96LEBXV67C2N7jzDk.jpg,JEW66E,350.00,0,0,0.00
3605540936931,Biotherm Supreme Youth Eye Serum for Men 15ml,Eye Serum,Biotherm,30.89,35,https://static.prod.qogita.com/files/images/variants/Rdca8wckC8RJKXWw6Fc2gc.jpg,LEKM75,350.00,0,0,0.00
0000030079236,Maybelline Colossal Volume Express Waterproof Mascara 10ml Glam Black,Mascara,Maybelline New York,3.42,1440,https://static.prod.qogita.com/files/images/variants/hLSBcK2vwweuumu7dseUYk.jpg,164O1R,350.00,0,0,0.00
3348901192224,Hypnotic Poison Eau de Parfum Spray 50ml,Eau De Parfum,Dior,62.96,6,https://static.prod.qogita.com/files/images/variants/5u83uoukE4FHEqvyJAhagM.jpg,16XOM1,500.00,0,0,0.00
3348901206174,"Christian Dior Addict Eau de Toilette for Women, 100ml",Eau De Toilette,Dior,82.89,30,https://static.prod.qogita.com/files/images/variants/jaoTNQHnMdFu3XmeMn8X9B.jpg,LEKM75,350.00,0,0,0.00
3348900417885,Dior J'adore Eau de Parfum 50ml,Eau De Parfum,Dior,76.39,79,https://static.prod.qogita.com/files/images/variants/eMLcZEG8PxGgdDpWvmnrHq.jpg,EMYX81,350.00,0,0,0.00
0888066023788,Tom Ford Neroli Portofino Eau De Parfum Spray 30ml,Eau De Parfum,Tom Ford,80.68,79,https://static.prod.qogita.com/files/images/variants/TUF7D9eKX28sq4rdyjcmuv.jpg,VV9JDK,350.00,0,0,0.00
3614274000566,Prada Paradaoxe Virtual Flower 50ml Eau de Parfum New in Box - New for 2024,Eau De Parfum,Prada,65.91,9,https://static.prod.qogita.com/files/images/variants/2y4UswrPvDHLfN7BSWjwuS.jpg,VVLDG9,350.00,0,0,0.00
3423478509757,L'Eau D'Issey Wood & Wood Eau De Perfume Spray 50ml,Eau De Parfum,Issey Miyake,20.85,46,https://static.prod.qogita.com/files/images/variants/Wcm8s5YJq3nTaNRGeHFN4d.jpg,8738KJ,350.00,0,0,0.00
8411061099728,Carolina Herrera Bad Boy Eau De Toilette 100ml Vaporizer,Eau De Toilette,Carolina Herrera,57.47,40,https://static.prod.qogita.com/files/images/variants/7njriego8hynk6QTC8qcUb.jpg,VV9JDK,350.00,0,0,0.00
3614272732087,Valentino Donna 50ml Eau De Parfum Spray,Eau De Parfum,Valentino,55.76,24,https://static.prod.qogita.com/files/images/variants/PorH5nraVyeLXQweyjdrWZ.jpg,5W7KXX,350.00,0,0,0.00
3386460075367,Jimmy Choo Illicit Flower Eau de Toilette 40ml,Eau De Toilette,Jimmy Choo,14.59,281,https://static.prod.qogita.com/files/images/variants/R6MhA9HAz4DL3RTX3Ej8XJ.jpg,335631,600.00,0,0,0.00
3274872447554,Givenchy Irresistible Rose Velvet Eau de Parfum for Women 50ml Spray,Eau De Parfum,Givenchy,48.58,36,https://static.prod.qogita.com/files/images/variants/Ej9nNVmxuu8yKLW8E7D7yL.jpg,JEL9LW,350.00,0,0,0.00
8005610568096,SP Hydrate Shampoo 250ml,Shampoo,Wella,4.33,360,https://static.prod.qogita.com/files/images/variants/KdrBMcnvGGXFfHR5oAmMR4.jpg,KLWQQD,350.00,0,0,0.00
3274872396203,Givenchy Ange Ou Demon Eau de Parfum Spray 30ml,Eau De Parfum,Givenchy,30.40,51,https://static.prod.qogita.com/files/images/variants/EjNqdVYti36wKJ6akbrpEH.jpg,6KLEXY,600.00,0,0,0.00
3614273953856,Acqua di Giò Profondo Eau de Parfum - Giorgio Armani - 50 ml Vaporisateur Rechargeable,Eau De Parfum,Giorgio Armani,52.93,152,https://static.prod.qogita.com/files/images/variants/FyB7MLZdkuXAUy5QhzwqFs.jpg,VVLDG9,350.00,0,0,0.00
0085805199180,Elizabeth Arden Green Tea Deodorant Spray 150ml,Deodorant & Anti-Perspirant,Elizabeth Arden,5.53,1057,https://static.prod.qogita.com/files/images/variants/giDgWzrbXinxYYe2nTRCA7.jpg,RDEJYJ,600.00,0,0,0.00
8057971180424,Dolce & Gabbana Pour Homme Eau de Toilette Men's Fragrance 125ml,Eau De Toilette,Dolce & Gabbana,44.63,15,https://static.prod.qogita.com/files/images/variants/M5iQRgtQzZ9bzJbxsDQr6p.jpg,YER629,350.00,0,0,0.00
3666057216480,Clarins Soothing Foaming Cleanser 125ml,Cleansing Foam,Clarins,12.58,184,https://static.prod.qogita.com/files/images/variants/ncum5pgeamNbE2szJKGxaa.jpg,VVLDG9,350.00,0,0,0.00
3616302514274,Gucci Bloom Eau de Toilette for Women 30ml,Eau De Toilette,Gucci,33.21,22,https://static.prod.qogita.com/files/images/variants/AHVo4H9wAsx3G89WebkuG3.jpg,16QJWR,600.00,0,0,0.00
3423478974654,Issey Miyake D Issey Eau de Toilette Spray 100ml,Eau De Toilette,Issey Miyake,24.32,22,https://static.prod.qogita.com/files/images/variants/69kQgi8w7C8bTwycfiMAQN.jpg,LE37MY,600.00,0,0,0.00
3614273927345,Lancôme Idole Now Eau de Parfum,Eau De Parfum,Lancôme,37.03,39,https://static.prod.qogita.com/files/images/variants/aKWnYGHQYoU3nFan8odbLt.jpg,873K33,600.00,0,0,0.00
3474637069230,L'Oréal Professionnel Series Expert Curl Expression Intensive Moisturiser Mask for Wavy and Curly Hair 250ml,Hair Masks,L'Oréal Professionnel,14.39,175,https://static.prod.qogita.com/files/images/variants/cKUhivmWkCjTZtu8gEexRQ.jpg,6K3JG9,350.00,0,0,0.00
3423222106201,L'Eau d'Issey Pour Homme Solar Lavender EDT - Issey Miyake - 50 ml,Eau De Toilette,Issey Miyake,27.93,500,https://prod-public-qogita-images.s3.eu-central-1.amazonaws.com/files/images/variants/6f37ced36498c7df3a3897a9dbbb3384.jpg,MOWM93,900.00,0,0,0.00
3616302038138,CHLOÉ Rose Naturelle Intense Eau de Parfum for Women Refillable 100ml,Eau De Parfum,Chloé,61.31,6,https://static.prod.qogita.com/files/images/variants/6Mv3uUnLV72uiay5E6BzrW.jpg,D3GL69,600.00,0,0,0.00
0783320420610,Bvlgari Omnia Amethyste Women's Perfume 100ml,Eau De Parfum,Bvlgari,72.39,10,https://static.prod.qogita.com/files/images/variants/YBhvwDyWkWzSzYdWahAAds.jpg,335631,600.00,0,0,0.00
3614273636490,Giorgio Armani Code Eau De Toilette for Men 150ml Refill,Refillable Fragrances & Refills,Giorgio Armani,63.49,52,https://static.prod.qogita.com/files/images/variants/HnHmWhcxZDECUxtgzY8KCj.jpg,YER629,350.00,0,0,0.00
3666057064555,Clarins Super Restorative Night Cream 50ml for Very Dry Skin,Night Cream,Clarins,54.12,12,https://static.prod.qogita.com/files/images/variants/fwWLamnMWuUNnnHvPWYRtc.jpg,VVLDG9,350.00,0,0,0.00
3614274089349,Prada Luna Rossa Ocean Le Parfum Refillable 50ml,Refillable Fragrances & Refills,Prada,57.17,27,https://static.prod.qogita.com/files/images/variants/iVk5ehhF8maN9JitpFY7iR.jpg,VV9JDK,350.00,0,0,0.00
3614273954174,ARM Acqua Di Gio Parfum 50 Complete,Eau De Parfum,Giorgio Armani,57.76,14,https://static.prod.qogita.com/files/images/variants/jkbGLsEUm5G96gyeEUacUp.jpg,VVLDG9,350.00,0,0,0.00
3614273749428,LANCOME Idole L'Eau de Parfum Nectar 25ml,Eau De Parfum,Lancôme,29.82,20,https://static.prod.qogita.com/files/images/variants/5E4L7Wnwgh6n7cw3taekeh.jpg,D3GL69,600.00,0,0,0.00
7640233340219,ELIE SAAB Girl of Now Forever EDP 50ml,Eau De Parfum,Elie Saab,27.75,88,https://static.prod.qogita.com/files/images/variants/JZSvjrpkVcrSqzm6t3D482.jpg,33Q84L,350.00,0,0,0.00
8011003827336,Versace Eros Eau De Parfum For Women Cedar 50ml,Eau De Parfum,Versace,32.33,479,https://static.prod.qogita.com/files/images/variants/Gr9o4vUnbZHePCNS6VmKsw.jpg,4ZWQYQ,350.00,0,0,0.00
3346130009474,Twilly D'Hermes Poivree by Hermes Eau De Parfum Spray 30ml,Eau De Parfum,Hermès,35.87,26,https://static.prod.qogita.com/files/images/variants/KhZh5uAg3fudHcL4wb4iq8.jpg,7XE172,1150.00,0,0,0.00
3614273983020,Giorgio Armani Si Intense 100ml Eau de Parfum Spray Refill Bottle - New!,Refillable Fragrances & Refills,Giorgio Armani,71.90,19,https://static.prod.qogita.com/files/images/variants/emc8ZtFjU5ci3nqwkPbyDp.jpg,XDR492,350.00,0,0,0.00
3473311941510,L'EAU REVEE DIKAR edt vapo 50ml,Eau De Toilette,Sisley,35.37,8,https://static.prod.qogita.com/files/images/variants/gpDkbQSH5poy3MADr4ux9j.jpg,YER629,350.00,0,0,0.00
3473311941015,L'EAU REVEE DIKAR edt vapo 100ml,Eau De Toilette,Sisley,56.18,46,https://static.prod.qogita.com/files/images/variants/SYo3qiuoGizCAcLmnWwKgt.jpg,16XOM1,500.00,0,0,0.00
3614272872370,Viktor and Rolf Flowerbomb Dew Eau de Parfum 50ml Spray,Eau De Parfum,Viktor & Rolf,39.24,16,https://static.prod.qogita.com/files/images/variants/hCF4u9nk8nwz44bPFtA6yW.jpg,XDR492,350.00,0,0,0.00
8411061723760,Carolina Herrera 212 VIP Men EDT Vapo 100ml,Eau De Toilette,Carolina Herrera,49.23,13,https://static.prod.qogita.com/files/images/variants/cjcPAiK9CgUtJQuwkfBVck.jpg,GELD3O,350.00,0,0,0.00
3147758235548,Hypnose for Women by Lancome 30ml EDP Spray,Eau De Parfum,Lancôme,30.95,186,https://static.prod.qogita.com/files/images/variants/K7UXRP6mfy4eyXiAjTTwvh.jpg,16E19R,350.00,0,0,0.00
3614273622639,Viktor & Rolf Flowerbomb Ruby Orchid Eau de Parfum 100ml,Eau De Parfum,Viktor & Rolf,65.72,2,https://static.prod.qogita.com/files/images/variants/X7jfEiFa3JDue4X5Rc3nHh.jpg,D3GL69,600.00,0,0,0.00
8058045433057,Trussardi Pure Jasmine EDP 60ml,Eau De Parfum,Trussardi,23.79,103,https://static.prod.qogita.com/files/images/variants/9ZFdwm8Q7zJ9DErccCk8YV.jpg,VVLDG9,350.00,0,0,0.00
3349668630448,Rabanne Fame Intense Spray 80ml,Eau De Parfum,Rabanne,72.53,24,https://static.prod.qogita.com/files/images/variants/nvHsttudTNur9xkCS57EUH.jpg,EMYX81,350.00,0,0,0.00
3423222107604,Narciso Rodriguez Musc Nude Eau de Parfum 30ml - Women's Fragrance,Eau De Parfum,Rodriguez,28.84,20,https://prod-public-qogita-images.s3.eu-central-1.amazonaws.com/files/images/variants/6f37ced36498c7df3a3897a9dbbb3384.jpg,JEL4DW,600.00,0,0,0.00
3423222048297,Zadig & Voltaire This Is Her! Vibes Of Freedom Eau De Parfum Natural Spray For Her 50ml,Eau De Parfum,Zadig & Voltaire,26.57,20,https://static.prod.qogita.com/files/images/variants/NQ8AxCoc8XtKJdUCPYnJDt.jpg,GELD3O,350.00,0,0,0.00
3605521172525,Giorgio Armani Acqua di Gioia Eau de Parfum 100ml,Eau De Parfum,Giorgio Armani,64.10,126,https://static.prod.qogita.com/files/images/variants/FzQnUSgVfjwLr2ZU2f79N4.jpg,16E19R,350.00,0,0,0.00
0887167142534,Estee Lauder Women's Nightwear Plus Anti-Oxidant Night Detox Cream 1.7 Ounce,Night Cream,Estée Lauder,32.50,99,https://static.prod.qogita.com/files/images/variants/H7YkLtT8k4QKUh8HW7p4us.jpg,VVL4XX,350.00,0,0,0.00
3274872441989,Givenchy L'Interdit Eau de Toilette Spray 80ml,Eau De Toilette,Givenchy,51.96,390,https://static.prod.qogita.com/files/images/variants/aiVMNkBBWrrbUn4drJQEGU.jpg,4ZWQYQ,350.00,0,0,0.00
3386460121538,Montblanc Explorer Ultra Blue Eau de Parfum 30ml,Eau De Parfum,Montblanc,17.81,43,https://static.prod.qogita.com/files/images/variants/mFQUtacTBGxhb6QGL4KtMW.jpg,EM8447,400.00,0,0,0.00
3386460066082,Boucheron Quatre Eau de Parfum Spray for Women 50ml,Eau De Parfum,Boucheron,18.57,1223,https://static.prod.qogita.com/files/images/variants/AVXBVtpQAuuKpPagbMMzFc.jpg,335631,600.00,0,0,0.00
6291106066722,Ramz Silver Eau de Parfum Spray by Lattafa,Eau De Parfum,Lattafa,7.95,819,https://static.prod.qogita.com/files/images/variants/nJrKzCuwg2aE536cnJz5yv.jpg,2V4GXZ,450.00,0,0,0.00
0088300196852,CALVIN KLEIN ck IN2U Eau de Toilette for Her Floral-Fruity Women's Fragrance 50ml,Eau De Toilette,Calvin Klein,11.00,406,https://static.prod.qogita.com/files/images/variants/2VozWmHmRriYct7GF9BJ3d.jpg,16QJWR,600.00,0,0,0.00
0888066117692,Tom Ford Ombre Leather Parfum 100ml,Eau De Parfum,Tom Ford,121.83,60,https://static.prod.qogita.com/files/images/variants/U85Q7rdhpnR6pPmkSw7Cp2.jpg,VV9JDK,350.00,0,0,0.00
0887167539587,Estée Lauder Revitalizing Supreme + Cell Power Eye balm 15 ml,Eye Cream,Estée Lauder,34.82,117,https://static.prod.qogita.com/files/images/variants/G4JYoUMsB2zXmuJpYCtwaN.jpg,7XE172,1150.00,0,0,0.00
3614273947787,Giorgio Armani My Way Nectar Eau de Parfum 30ml Spray,Eau De Parfum,Giorgio Armani,39.39,54,https://static.prod.qogita.com/files/images/variants/6QoWBESpZnSHLHudrE7oSg.jpg,D3VZ59,600.00,0,0,0.00
3666057177651,Multi-Active Night Cream All Skin Types 50ml,Night Cream,Clarins,33.18,75,https://static.prod.qogita.com/files/images/variants/WxectRWRJ9A9Sry3dLnChi.jpg,VVLDG9,350.00,0,0,0.00
3473311961006,Sisley Eau De Soir Eau De Parfum Vapo 50ml,Eau De Parfum,Sisley,,0,https://static.prod.qogita.com/files/images/variants/HpSqcjjsLVpT5et2vDDyZZ.jpg,87WEZ3,1150.00,0,0,0.00
3346470113534,Guerlain Shalimar Eau de Parfum 30ml,Eau De Parfum,Guerlain,38.20,26,https://static.prod.qogita.com/files/images/variants/Kg4W3KHbHGVBRC9EsToA9s.jpg,GE3VVO,600.00,0,0,0.00
8011003818112,Versace Bright Crystal Absolu Eau de Parfum 90ml,Eau De Parfum,Versace,44.21,25,https://static.prod.qogita.com/files/images/variants/CyYthpFfNtsW3FjVPssS3Z.jpg,YEO149,350.00,0,0,0.00
3666057031380,Clarins Tonic Sugar Polisher 250g,Body Scrub & Peeling,Clarins,21.10,15,https://static.prod.qogita.com/files/images/variants/8KY3qJKaEUua8g8L7okibD.jpg,VVLDG9,350.00,0,0,0.00
0737052993546,Hugo Boss The Scent Deodorant Stick 75ml,Deodorant & Anti-Perspirant,Hugo Boss,9.01,347,https://static.prod.qogita.com/files/images/variants/4vE37VgQoUu34L4Hw3RWSU.jpg,JEL4DW,600.00,0,0,0.00
3473311426017,Sisley Express Radiance Mask Red Clay Unisex 60ml,Clay Mask,Sisley,49.74,65,https://static.prod.qogita.com/files/images/variants/nJssa2MtzkcoqFb25TsMwC.jpg,5W7KXX,350.00,0,0,0.00
8411061926093,Carolina Herrera Men's Bad Boy Eau de Toilette 50ml,Eau De Toilette,Carolina Herrera,46.03,21,https://static.prod.qogita.com/files/images/variants/NrG7vbGHRJrrCJZk7i57NM.jpg,7X5Z9J,600.00,0,0,0.00
3337872413025,La Roche-Posay Effaclar Mat Mattifying Face Care Moisturizer For Oily Skin 40ml,Face Cream,La Roche-Posay,11.43,28,https://static.prod.qogita.com/files/images/variants/YHEugiUnGQSnNGxw2okAgh.jpg,164O1R,350.00,0,0,0.00
3365440025578,Yves Saint Laurent Opium Homme Eau De Toilette Spray 100ml for Men,Eau De Toilette,Yves Saint Laurent,59.90,864,https://static.prod.qogita.com/files/images/variants/33dZpFTzsf4bfkTHnFbh8f.jpg,WEDJJK,350.00,0,0,0.00
3386461515688,Eclat D'arpege Eau De Perfume Spray 50ml,Eau De Parfum,Lanvin,18.16,284,https://static.prod.qogita.com/files/images/variants/LprXsgQPXNuUChaNrHqNUV.jpg,XDR492,350.00,0,0,0.00
6290360591490,Lattafa Bayaan 3.4 Eau de Parfum Spray,Eau De Parfum,Lattafa,13.39,578,https://static.prod.qogita.com/files/images/variants/6gqBqXb9znX8ifXqVpuLwS.jpg,VV9JDK,350.00,0,0,0.00
8435415065191,Jean Paul Gaultier Scandal Le Parfum Him Eau de Parfum Spray 100ml,Eau De Parfum,Jean Paul Gaultier,68.08,100,https://static.prod.qogita.com/files/images/variants/hRTiKte2pngG76Djrq7z96.jpg,VV9JDK,350.00,0,0,0.00
3386460118675,Montblanc Explorer Eau de Parfum 200ml,Eau De Parfum,Montblanc,48.70,32,https://static.prod.qogita.com/files/images/variants/YobQSNNgT3uuqZZtCaHa3Y.jpg,YEO149,350.00,0,0,0.00
0020714157760,Clinque Eye Cream 15ml,Eye Cream,Clinique,20.69,32,https://static.prod.qogita.com/files/images/variants/5ubi2JvzY7P2qB3hDX8Gqg.jpg,D3VZ59,600.00,0,0,0.00
0027131019817,Estee Lauder Private Collection Eau de Parfum Spray 1.7oz 50ml,Eau De Parfum,Estée Lauder,32.05,38,https://static.prod.qogita.com/files/images/variants/Jj5P3h8pdJmyExye3Sjz9i.jpg,XDG2ZY,350.00,0,0,0.00
0027131595045,Sensuous Estee Lauder 1.7 oz EDP Spray for Women,Eau De Parfum,Estée Lauder,20.16,76,https://static.prod.qogita.com/files/images/variants/mMs59kcfTZzowR5nvZYn77.jpg,VVL4XX,350.00,0,0,0.00
3423473020523,Dolce&Gabbana Light Blue Eau de Toilette Spray for Men 40ml,Eau De Toilette,Dolce & Gabbana,23.77,358,https://static.prod.qogita.com/files/images/variants/8jPjzJrxMwP2KuoMBwXx6f.jpg,5W7KXX,350.00,0,0,0.00
3614273069533,Yves Saint Laurent Libre Eau De Parfum Intense Spray 30ml,Eau De Parfum,Yves Saint Laurent,49.26,13,https://static.prod.qogita.com/files/images/variants/btGyJPq5jEgN98AXdTpeg5.jpg,875W4X,350.00,0,0,0.00
3433422408159,La Roche Posay Effaclar Astringent Lotion 200ml,Pimple & Blackhead Treatments,La Roche-Posay,7.19,59,https://static.prod.qogita.com/files/images/variants/DioLzCYHpLHYCcMc65b27F.jpg,JEL9LW,350.00,0,0,0.00
0085805071370,Elizabeth Arden Green Tea Refreshing Body Lotion 500ml,Body Lotion,Elizabeth Arden,7.01,347,https://static.prod.qogita.com/files/images/variants/BQbmvzdXoVHVB2tXMSFhoN.jpg,16QJWR,600.00,0,0,0.00
3360377002968,Ralph Lauren Romance EDP Spray 100ml,Eau De Parfum,Ralph Lauren,37.23,24,https://static.prod.qogita.com/files/images/variants/ce5AvsXkZzb8SAecrhbyR9.jpg,8738KJ,350.00,0,0,0.00
3386460066136,Boucheron Eau De Toilette 100ml,Eau De Toilette,Boucheron,19.57,42,https://static.prod.qogita.com/files/images/variants/Jikk9WDivEvh4HBkBCNdEg.jpg,335631,600.00,0,0,0.00
8057971180530,Dolce & Gabbana The One for Men Eau De Toilette 50 ml,Eau De Toilette,Dolce & Gabbana,29.52,1250,https://static.prod.qogita.com/files/images/variants/UF6awaQt7YsYnJaGqTZX9J.jpg,XDR492,350.00,0,0,0.00
6290360598352,Lattafa The Kingdom Eau De Parfum Spray for Women 3.4 Ounce,Eau De Parfum,Lattafa,12.16,947,https://static.prod.qogita.com/files/images/variants/9CfMY5h3TGtXbTH3RQcMvu.jpg,D3JVOD,350.00,0,0,0.00
3380814700219,Clarins Instant Smooth 15ml Face Primer,Face Cream,Clarins,14.38,353,https://static.prod.qogita.com/files/images/variants/Q94QaD4AmBjnnSAqvSJV4E.jpg,VVLDG9,350.00,0,0,0.00
3348900321861,Dune pour Homme Eau De Toillete 100ml,Eau De Toilette,Dior,61.85,10,https://static.prod.qogita.com/files/images/variants/mDNhKFNtB4YQKYSFt7y8HR.jpg,16XOM1,500.00,0,0,0.00
