product name,product link
"Żel stymulujący, wibrator w płynie Intt Ice",https://www.venus.net.pl/257881-zel-stymulujacy-wibrator-w-plynie-intt-ice-5600304015301.html
Żel stymulujący o smaku truskawki Intt...,https://www.venus.net.pl/257882-zel-stymulujacy-o-smaku-truskawki-intt-vibration-strawberry-15-ml-5600304015325.html
Żel stymulujący o smaku wódki Intt...,https://www.venus.net.pl/257883-zel-stymulujacy-o-smaku-wodki-intt-vibration-vodka-energy-15ml-5600304015318.html
Żel stymulujący o smaku konopii Intt...,https://www.venus.net.pl/262012-zel-stymulujacy-o-smaku-konopii-intt-vibration-ganjah-15-ml-5600304015332.html
Żel stymulujący o smaku gumy balonowej...,https://www.venus.net.pl/262017-zel-stymulujacy-o-smaku-gumy-balonowej-intt-vibration-bubble-gum-15-ml-5600304015486.html
Żel stymulujący o smaku kawy Intt...,https://www.venus.net.pl/265677-zel-stymulujacy-o-smaku-kawy-intt-vibration-coffee-15-ml-5600304015547.html
Żel stymulujący o smaku ginu z tonikiem...,https://www.venus.net.pl/287547-zel-stymulujacy-o-smaku-ginu-z-tonikiem-vibration-gin-and-tonic-15-ml-5600304015493.html
Żel wibrujący o smaku waty cukrowej Intt...,https://www.venus.net.pl/338655-zel-wibrujacy-o-smaku-waty-cukrowej-intt-vibration-cotton-candy-liquid-vibrator-15ml-5600781416240.html
Krem stymulujący Atomic for Woman Gel 10 ml,https://www.venus.net.pl/16663-zel-silikonowy-jo-for-woman-clitoral-atomic-gel-10-ml-796494401798.html
Krem stymulujący Warm & Buzzy Stimulant 10 ml,https://www.venus.net.pl/218356-jo-warm-buzzy-stimulant-10ml-796494412169.html
Żel stymulujący dla kobiet Shiatsu Ginger...,https://www.venus.net.pl/260992-zel-sprej-stimulation-gel-ginger-cinnamon-30mlfor-women-4042342005158.html
Stymulujący żel dla kobiet O Stimulation...,https://www.venus.net.pl/190236-pobudzajacy-zel-dla-kobiet-hot-o-stimulation-gel-women-15-ml-4042342003550.html
Żel stymulujący TripleX Pleasure Enhancer...,https://www.venus.net.pl/262620-triplex-pleasure-enhancer-gel-8435097836515.html
Krem stymulujący Lady Orgasm for Women 15 ml,https://www.venus.net.pl/269589-lady-orgasm-15-ml-cream-for-woman-3479228000470.html
Spray stymulujący Wow! Strawberry Ice...,https://www.venus.net.pl/298995-spray-stymulujacy-wow-strawberry-ice-bucal-spray-10-ml-5600298351935.html
Krem na erekcję Ero Prorino Erection Cream...,https://www.venus.net.pl/96864-krem-na-erekcje-ero-prorino-erection-cream-for-men-100ml-4042342003307.html
Krem powiększający penisa Diehard Penis...,https://www.venus.net.pl/235526-krem-powiekszajacy-penisa-diehard-penis-enlarger-50-ml-8714273302182.html
Krem na erekcję Prorino XXL Gold Edition 50ml,https://www.venus.net.pl/289191-prorino-xxl-gold-edition-4042342004540.html
Krem wspomagający dla mężczyzn Ero Prorino...,https://www.venus.net.pl/292644-krem-wspomagajacy-dla-mezczyzn-ero-prorino-rino-cream-strong-50ml-4042342004373.html
Krem na powiększenie penisa Prorino XXXL...,https://www.venus.net.pl/331029-krem-na-powiekszenie-penisa-prorino-xxxl-cream-for-men-65ml-4042342004441.html
Żel na powiększenie penisa Maxi Size 150 ml,https://www.venus.net.pl/233419-zel-na-powiekszenie-penisa-maxi-size-150-ml-5907776180194.html
Krem na powiększenie penisa Boo...,https://www.venus.net.pl/284030-krem-na-powiekszenie-penisa-boo-enlargement-cream-men-50-ml-8719632670131.html
Krem powiększający penisa Penimax 50ml,https://www.venus.net.pl/286246-krem-powiekszajacy-penisa-penimax-50ml-3548960010532.html
Serum opóźniające wytrysk Orgie Xtra Time...,https://www.venus.net.pl/262781-serum-opozniajace-wytrysk-orgie-xtra-time-15ml-5600298351218.html
Krem opóźniający wytrysk Erecta Extend...,https://www.venus.net.pl/8447-krem-opozniajacy-wytrysk-erecta-extend-penis-cream-40ml-8713221216618.html
Krem przedłużający stosunek Ero Prorino...,https://www.venus.net.pl/240284-ero-prorino-long-power-delay-cream-50ml-4042342004564.html
Żel opóźniający wytrysk Cobeco Clove Delay...,https://www.venus.net.pl/285563-zel-opozniajacy-wytrysk-cobeco-clove-delay-gel-60-ml-8718546549366.html
Spray opóźniający wytrysk Stud Delay Spray...,https://www.venus.net.pl/1925-spray-opozniajacy-wytrysk-stud-delay-spray-15ml-8717344171397.html
Spray opóźniający wytrysk Retard 907,https://www.venus.net.pl/15996-spray-opozniajacy-wytrysk-retard-907-3548960030813.html
Spray opóźniający wytrysk Orgasm Off 50ml,https://www.venus.net.pl/234630-spray-opozniajacy-wytrysk-orgasm-off-50ml-5903268070349.html
Spray przedłużający stosunek dla mężczyzn...,https://www.venus.net.pl/255563-stud-100ml-5903268070462.html
Krople pobudzające Shs Sex Elixir Premium...,https://www.venus.net.pl/216237-krople-pobudzajace-shs-sex-elixir-premium-100ml-20011190.html
Krople pobudzające Spanish Fly Extreme Men...,https://www.venus.net.pl/84260-krople-spanish-fly-extreme-men-30ml-4042342002256.html
Krople pobudzające Love Drops 30 ml,https://www.venus.net.pl/84264-krople-pobudzajace-ero-love-drops-30-ml-4042342002294.html
Krople na Libido Elixir For Women 30ml,https://www.venus.net.pl/265831-krople-na-libido-elixir-for-women-30ml-5907632923385.html
Krople wzmagające doznania seksualne...,https://www.venus.net.pl/8389-krople-wzmagajace-doznania-seksualne-spanish-fly-gold-15ml-8717344178778.html
Krople pobudzające Love Drops Power 30ml,https://www.venus.net.pl/232376-love-drops-power-30ml-1400000000205.html
Krople zwiększające libido Sex Elixir 15ml,https://www.venus.net.pl/234563-sex-elixir-15-ml-000001700008.html
Jadalny olejek do masażu Warm Up...,https://www.venus.net.pl/7614-jadalny-olejek-do-masazu-warm-up-strawberry-150ml-4028403143144.html
Jadalny olejek do masażu Warm Up Caramel...,https://www.venus.net.pl/12409-rozgrzewajacy-olejek-do-masazu-o-karmelowym-smaku-warmup-caramel-150ml-4028403143250.html
Jadalny olejek do masażu Warm Up Mango +...,https://www.venus.net.pl/218871-warmup-mangomaracuja-150-ml-4028403143311.html
Jadalny olejek do masażu Warm Up Mint 150 ml,https://www.venus.net.pl/298396-jadalny-olejek-do-masazu-warm-up-mint-150-ml-4028403143335.html
Olejek do masażu Shunga Aphrodisiac Oil 100ml,https://www.venus.net.pl/78337-olejek-do-masazu-shunga-aphrodisiac-oil-100ml-697309020060.html
Olejek do masażu Shunga Aphrodisiac Oil...,https://www.venus.net.pl/78338-olejek-do-masazu-shunga-aphrodisiac-oil-vanilla-100ml-697309020077.html
Olejek do masażu Shunga Aphrodisiac Oil...,https://www.venus.net.pl/81891-olejek-do-masazu-shunga-aphrodisiac-oil-romance-100ml-697309020084.html
Olejek do masażu Shunga Irresistible Asian...,https://www.venus.net.pl/270569-shunga-massage-al-irresistible-asian-fusion-240ml-697309012188.html
Świeca do masażu Shunga Candle Vanilla...,https://www.venus.net.pl/199863-swieca-do-masazu-shunga-candle-30-ml-fetish-desire-697309046015.html
Świeca do masażu Shunga Candle Excitation...,https://www.venus.net.pl/201774-shunga-excitation-massage-candle-30-ml-697309046091.html
Czekoladowa świeca do masażu Shunga...,https://www.venus.net.pl/212537-shunga-excitation-massage-candle-170-ml-697309045094.html
Zestaw świec do masażu Ouch!,https://www.venus.net.pl/291350-massage-candle-set-pheromone-vanilla-rose-scented-8714273544384.html
Perfumy damskie z feromonami PheroStrong...,https://www.venus.net.pl/298899-perfumy-damskie-z-feromonami-pherostrong-pheromone-beauty-for-women-50ml-5905669259927.html
Damskie perfumy z feromonami PheroStrong...,https://www.venus.net.pl/300952-damskie-perfumy-z-feromonami-pherostrong-pheromone-perfect-for-women-50ml-5905669259873.html
Perfumy damskie z feromonami PheroStrong...,https://www.venus.net.pl/300953-perfumy-damskie-z-feromonami-pherostrong-hq-50ml-5905669259866.html
Damskie perfumy z feromonami PheroStrong...,https://www.venus.net.pl/300955-damskie-perfumy-z-feromonami-pherostrong-pheromone-only-for-women-50ml-5905669259897.html
Perfumy z feromonami dla kobiet...,https://www.venus.net.pl/245986-perfumy-z-feromonami-dla-kobiet-pherostrong-limited-edition-for-woman-50ml-5905669259460.html
Perfumy z feromonami dla mężczyzn...,https://www.venus.net.pl/293670-perfumy-z-feromonami-dla-mezczyzn-pherostrong-pheromone-popularity-for-men-50ml-5905669259989.html
Perfumy męskie z feromonami PheroStrong...,https://www.venus.net.pl/298897-perfumy-meskie-z-feromonami-pherostrong-pheromone-just-for-men-50ml-5905669259972.html
Męskie perfumy z feromonami PheroStrong...,https://www.venus.net.pl/298898-meskie-perfumy-z-feromonami-pherostrong-pheromone-beast-for-men-50-ml-5905669259996.html
Krem Ero Anal Backside 30 ml,https://www.venus.net.pl/92015-krem-ero-anal-backside-30-ml-4042342003086.html
Krem wybielający miejsca intymne Ero Anal...,https://www.venus.net.pl/171154-krem-wybielajacy-miejsca-intymne-anal-whitening-cream-75-ml-4042342003581.html
Krem zwężający odbyt Backside Anal...,https://www.venus.net.pl/189178-krem-sciesniajacy-odbyt-backside-anal-tightening-50-ml-4042342003604.html
Znieczulający krem do miłości analnej Anal...,https://www.venus.net.pl/235404-anal-ease-20ml-8714273301925.html
Tabletki stymulujące Ero Men Energy Caps 5...,https://www.venus.net.pl/84270-tabletki-stymulujace-ero-men-energy-caps-5-tab-4042342002454.html
Tabletki pobudzające Exxtreme Power Caps...,https://www.venus.net.pl/189850-exxtreme-power-caps-10-szt-4042342001709.html
Tabletki na zwiększenie ilości spermy Cum...,https://www.venus.net.pl/233506-cum-plus-east-8717344179935.html
Tabletki dla męźczyzn Man complete 60 kaps,https://www.venus.net.pl/273895-tabletki-dla-mezczyzn-man-complete-60-kaps-5907632923408.html
Kapsułki pobudzające dla kobiet Ero...,https://www.venus.net.pl/214983-ero-prorino-libido-caps-for-women-10er-4042342003253.html
Tabletki pobudzające dla kobiet Euforia...,https://www.venus.net.pl/232254-tabletki-pobudzajace-dla-kobiet-euforia-60szt-5902020143505.html
Suplement diety dla kobiet- LSTIM...,https://www.venus.net.pl/291001-suplement-diety-dla-kobiet-lstim-womanizer-80kaps-5903268071308.html
Tabletki wspomagające funkcje seksualne...,https://www.venus.net.pl/291665-pleasure-max-90-kaps-5903796650686.html
Krem powiększający penisa Maxi Penis 50ml,https://www.venus.net.pl/190753-krem-powiekszajacy-penisa-maxi-penis-50ml-3479228000821.html
Spray opóźniający wytrysk Pleasure...,https://www.venus.net.pl/272526-spray-opozniajacy-wytrysk-pleasure-prolonging-formula-10-ml-3700444604990.html
